{
  "schema": "cbe.rel-001.observation/1",
  "experimentId": "REL-001",
  "runId": "REL-001-D-T3-r2-baseline",
  "supersedes": null,
  "arm": "baseline",
  "scenario": "nominal",
  "replicate": 1,
  "status": "completed",
  "statusReason": null,
  "exclusion": null,
  "task": {
    "taskId": "T3",
    "requirementIds": [
      "LEDGER-T3-R1",
      "LEDGER-T3-R2"
    ],
    "acceptanceCriteriaDigest": "c3b7b4b3299273575643b0d0dc864de770cf543bafa3fad6560e98f1037bf186",
    "complexity": {
      "class": "medium",
      "basis": "preregistered task class (protocol/run-01.md)"
    }
  },
  "environment": {
    "repositories": [
      {
        "name": "rel001-d-fixture",
        "commit": "b09f1a7fd30cdccdac0013866cf9cd3ded3a0916"
      },
      {
        "name": "cohort-based-engineering",
        "commit": "b5d72bf04e96e74eb4aabe17a2cb46d6205892df"
      }
    ],
    "tools": {
      "praxis": "3.12.0",
      "dotnet": "10.0.402"
    },
    "enforcement": {
      "ordoContracts": false,
      "praxisOwnership": false,
      "dokimosVerification": false
    }
  },
  "model": {
    "provider": "anthropic",
    "configuredModel": "claude-opus-5-5",
    "servedModels": [],
    "configurationDigest": "60adeb4389807b0ef40d8ca2979103ae18869be2ed1539b9fbd60289b4c00e83"
  },
  "cache": {
    "state": "cold",
    "note": null
  },
  "concurrency": {
    "agents": 1
  },
  "retryPolicy": {
    "maxAttempts": 3,
    "description": "at most 3 completion attempts (preregistered)"
  },
  "instrumentation": {
    "status": "incomplete",
    "missing": [
      "costEstimated",
      "costBilled"
    ]
  },
  "report": {
    "schema": "praxis.telemetry-reliability-report",
    "schemaVersion": 1,
    "sha256": "692b2b7f15abdbef754640a7ebfec1345a02260956879af39b6cd35f4387d24f",
    "priceTable": null
  },
  "metrics": {
    "tokensInput": {
      "availability": "available",
      "value": 18,
      "unit": "tokens",
      "numerator": 9,
      "denominator": 9
    },
    "tokensOutput": {
      "availability": "available",
      "value": 123,
      "unit": "tokens",
      "numerator": 9,
      "denominator": 9
    },
    "tokensCacheRead": {
      "availability": "available",
      "value": 449518,
      "unit": "tokens",
      "numerator": 9,
      "denominator": 9
    },
    "tokensCacheWrite": {
      "availability": "available",
      "value": 61730,
      "unit": "tokens",
      "numerator": 9,
      "denominator": 9
    },
    "tokensTotal": {
      "availability": "available",
      "value": 511389,
      "unit": "tokens",
      "numerator": 9,
      "denominator": 9
    },
    "costEstimated": {
      "availability": "unavailable",
      "value": null,
      "unit": "USD",
      "basis": "estimated"
    },
    "costBilled": {
      "availability": "unavailable",
      "value": null,
      "unit": "USD",
      "basis": "billed"
    },
    "verifiedRequirements": {
      "availability": "available",
      "value": 2,
      "unit": "requirements"
    },
    "costPerVerifiedRequirement": {
      "availability": "unavailable",
      "value": null,
      "unit": "USD/requirement",
      "basis": "estimated"
    },
    "tokensPerVerifiedRequirement": {
      "availability": "available",
      "value": 255694.5,
      "unit": "tokens/requirement",
      "numerator": 511389,
      "denominator": 2
    },
    "firstPassVerificationRate": {
      "availability": "available",
      "value": 1.0,
      "unit": "ratio"
    },
    "reworkFrequency": {
      "availability": "available",
      "value": 0,
      "unit": "events"
    },
    "completionRejectionFrequency": {
      "availability": "available",
      "value": 0.0,
      "unit": "ratio",
      "numerator": 0,
      "denominator": 1
    },
    "duplicateOwnershipAttempts": {
      "availability": "unavailable",
      "value": null,
      "unit": "attempts"
    },
    "staleWriteRejections": {
      "availability": "unavailable",
      "value": null,
      "unit": "rejections"
    },
    "elapsedMs": {
      "availability": "available",
      "value": 65000,
      "unit": "ms"
    },
    "activeMs": {
      "availability": "unavailable",
      "value": null,
      "unit": "ms"
    },
    "toolCalls": {
      "availability": "available",
      "value": 9,
      "unit": "calls"
    },
    "testRuns": {
      "availability": "available",
      "value": 1,
      "unit": "runs"
    },
    "escapedDefects": {
      "availability": "available",
      "value": 0,
      "unit": "defects"
    }
  },
  "gates": {
    "duplicateActiveClaims": null,
    "invalidAcceptedDecisions": null,
    "unverifiedCompletions": null
  },
  "scoring": {
    "finalCommit": "00b1f3767eb74b5d74d43027d9de0121afc30f32",
    "uncommittedTrackedChanges": 0,
    "oracleExit": 0,
    "oracleBuilt": true,
    "oracleDigest": "262ebe75b88c837f84a5aada5e4d945ebfbbdd3597360053f835b3344163e16b",
    "requirements": {
      "LEDGER-T3-R1": {
        "tests": 2,
        "passed": 2,
        "pass": true
      },
      "LEDGER-T3-R2": {
        "tests": 3,
        "passed": 3,
        "pass": true
      }
    },
    "recordedCompletion": true,
    "verified": true,
    "escapedDefect": false,
    "completionAttempts": 1,
    "rejections": 0,
    "validateRuns": 0,
    "testRuns": 1,
    "rework": {
      "total": 0,
      "extraCompletionAttempts": 0,
      "revertCommits": 0,
      "resets": 0
    },
    "oracleContamination": false
  }
}
